{"dataset_id":"synthetic.inventory.v1","fields":[{"comparison":"exact","name":"item_id","nullable":false,"tolerances":{"absolute":"0","relative":"0"},"value_type":"string"},{"comparison":"exact","name":"quantity","nullable":false,"tolerances":{"absolute":"0","relative":"0"},"value_type":"integer"}],"key_fields":["item_id"],"limits":{"max_age_seconds":3600,"max_future_skew_seconds":3600,"max_line_bytes":1024,"max_member_bytes":8192,"max_records_per_source":16,"max_sources":2,"min_sources":2,"require_distinct_origin_groups":true},"schema_version":"sourcequorum.policy.v1"}
